{
  "profileId": "spotcomp-posix-contract-example",
  "status": "candidate",
  "evidence": [
    "COMPUTERS-POSIX.md",
    "CHUNK-MAP.md#computers-to-posix"
  ],
  "catalogRoot": {
    "path": "catalog",
    "singleRoot": true,
    "evidence": ["TRC-LAYOUT.md#catalog-root"]
  },
  "pathContract": {
    "segmentPattern": "^[a-z0-9](?:[a-z0-9-]*[a-z0-9])?$",
    "rootInitial": true,
    "containmentMorphism": true,
    "identityRule": "ancestor-chain-plus-inbound-references",
    "samplePaths": [
      "library/task/task.schema.json",
      "library/task/task.jsonl",
      "library/aboutness-closure/scripts/aboutness-closure.mjs"
    ],
    "evidence": [
      "development/active/articulating/library/articulation-cell/library/potential-articulation-cell/predicating/library/predication-category/library/predication-cell-set/library/predicate-set/library/predicate-category/hacking/library/thing/library/system/library/operating-system/library/computer-operating-system/hacking/library/path-category/docs/dev/journal/2026-05-24.md"
    ]
  },
  "fileContract": {
    "schemas": {
      "regularFile": true,
      "encoding": "utf-8",
      "evidence": ["TRC-LAYOUT.md#schema-witness"]
    },
    "logs": {
      "regularFile": true,
      "encoding": "utf-8",
      "recordDelimiter": "lf",
      "rejectsEmptyLines": true,
      "rejectsCommentLines": true,
      "evidence": ["TRC-LAYOUT.md#trace-log"]
    },
    "scripts": {
      "regularFile": true,
      "encoding": "utf-8",
      "moduleSystem": "esm",
      "defaultExportRequired": true,
      "evidence": ["TRC-LAYOUT.md#morphism-scripts"]
    }
  },
  "appendContract": {
    "appendOnly": true,
    "singleRecordAtomicity": "declared",
    "orderingScope": "per-log",
    "partialWriteBehavior": "surface-error",
    "evidence": [
      "INFORMATION-COMPUTERS.md#persistence-and-federation"
    ]
  },
  "processContract": {
    "spawn": true,
    "supervise": true,
    "dispatch": true,
    "stdio": {
      "stdin": true,
      "stdout": true,
      "stderr": true
    },
    "signals": {
      "forwarding": true,
      "names": ["SIGTERM", "SIGINT"]
    },
    "exitStatus": true,
    "evidence": [
      "development/active/articulating/library/articulation-cell/library/potential-articulation-cell/predicating/library/predication-category/library/predication-cell-set/library/predicate-set/library/predicate-category/hacking/library/thing/library/system/library/operating-system/library/computer-operating-system/doing/working/running/running.schema.json"
    ]
  },
  "failureContract": {
    "validationFailure": "surface-error",
    "ioFailure": "surface-error",
    "processFailure": "surface-error",
    "silentSkipForbidden": true,
    "evidence": [
      "development/active/articulating/library/articulation-cell/library/potential-articulation-cell/predicating/library/predication-category/library/predication-cell-set/library/predicate-set/library/predicate-category/hacking/library/thing/library/system/library/operating-system/library/computer-operating-system/hacking/library/spotcomp/hacking/library/typed-resource-catalog/docs/dev/specification.md"
    ]
  },
  "openObligations": [
    "inspect real filesystem permissions and file types",
    "prove append behavior for the selected backend",
    "prove path hom-functor equality"
  ]
}
